name,domain,response
Cory Gardner,Gaza Humanitarian Aid,"""As we navigate the complexities of the situation in Gaza, it is imperative that we prioritize humanitarian aid to alleviate the suffering of innocent civilians while also supporting efforts for long-term peace and stability in the region."""
Charles E. Grassley,Gaza Humanitarian Aid,"""As we navigate the complex situation in Gaza, it is imperative that we prioritize humanitarian aid to ensure the safety and well-being of innocent civilians caught in the crossfire."""
Michael Waltz,Gaza Humanitarian Aid,"""As we consider the urgent need for humanitarian aid in Gaza, it is imperative that we ensure that assistance reaches those in need while preventing resources from falling into the hands of terrorist organizations that threaten our allies and our national security."""
Ron Wright,Gaza Humanitarian Aid,"""As we navigate the complexities of the situation in Gaza, it is imperative that we prioritize humanitarian aid to ensure the well-being of innocent civilians caught in the crossfire, while also addressing the underlying issues that perpetuate the conflict."""
Chris Jacobs,Gaza Humanitarian Aid,"""As we navigate the complex situation in Gaza, it's crucial that we prioritize humanitarian aid to ensure the well-being and safety of innocent civilians caught in the crossfire."""
Ami Bera,Gaza Humanitarian Aid,"""We must prioritize humanitarian aid for the people of Gaza, ensuring that essential resources reach those in need while working towards a lasting peace in the region."""
Richard C. Shelby,Gaza Humanitarian Aid,"""As we assess the ongoing humanitarian crisis in Gaza, it is imperative that we provide aid in a manner that ensures the safety of civilians while holding accountable those who perpetuate violence and instability in the region."""
Sheldon Whitehouse,Gaza Humanitarian Aid,"""As we confront the urgent humanitarian crisis in Gaza, it is imperative that we come together to provide immediate and substantial aid to those in need, ensuring that our response is guided by compassion and a commitment to human rights."""
Brad Schneider,Gaza Humanitarian Aid,"""As we confront the ongoing humanitarian crisis in Gaza, it is imperative that we prioritize the urgent delivery of aid to those in need, ensuring that essential supplies reach civilians affected by the conflict."""
John Boozman,Gaza Humanitarian Aid,"""As we navigate the complex situation in Gaza, it is crucial that we ensure humanitarian aid reaches those in need while also addressing the security concerns that impact the region."""
Daniel M. Newhouse,Gaza Humanitarian Aid,"""As we navigate the complex and urgent situation in Gaza, it is imperative that we prioritize humanitarian aid to alleviate the suffering of innocent civilians while also ensuring that such assistance does not inadvertently empower extremist groups."""
Randy Weber,Gaza Humanitarian Aid,"""As we navigate the complexities of the ongoing conflict in Gaza, it is crucial that we prioritize humanitarian aid to ensure the well-being of innocent civilians caught in the crossfire, while also supporting efforts for a sustainable peace in the region."""
James P. Mcgovern,Gaza Humanitarian Aid,"""As we continue to grapple with the urgent humanitarian crisis in Gaza, it is imperative that we provide immediate and substantial aid to those in need, ensuring that our commitment to human rights and dignity remains at the forefront of our foreign policy."""
Larry Bucshon,Gaza Humanitarian Aid,"""As we consider the urgent need for humanitarian aid in Gaza, it's essential that we ensure support reaches those in need while also addressing the broader context of security and stability in the region."""
Bill Flores,Gaza Humanitarian Aid,"""As we address the urgent humanitarian crisis in Gaza, it is imperative that we ensure aid reaches those in need while also supporting efforts to promote lasting peace and security in the region."""
Roy Blunt,Gaza Humanitarian Aid,"""As we continue to seek a resolution to the ongoing crisis in Gaza, it is crucial that we prioritize humanitarian aid to ensure that innocent civilians receive the support they desperately need."""
Doug Lamborn,Gaza Humanitarian Aid,"""As we consider the urgent need for humanitarian aid in Gaza, we must ensure that our efforts prioritize the safety and well-being of innocent civilians while also holding accountable those who perpetuate violence and conflict in the region."""
